shriram@shriram-VirtualBox:~$ sudo tcpdump -i enp0s3
tcpdump: verbose output suppressed, use -v[v]... for full protocol decode
listening on enp0s3, link-type EN10MB (Ethernet), snapshot length 262144 bytes
22:40:09.487166 IP 10.0.2.15.ssh > 10.0.2.2.52196: Flags [P.], seq 1561246522:1561246718, ack 6597263, win 61407, length 196
22:40:09.487754 IP 10.0.2.2.52196 > 10.0.2.15.ssh: Flags [.], ack 196, win 65535, length 0
22:40:09.580759 IP 10.0.2.15.48365 > 10.0.2.3.domain: 32186+ PTR? 2.2.0.10.in-addr.arpa. (39)
22:40:09.592392 IP 10.0.2.3.domain > 10.0.2.15.48365: 32186* 1/0/0 PTR 10.0.2.2. (61)
22:40:09.593466 IP 10.0.2.15.44823 > 10.0.2.3.domain: 35293+ PTR? 15.2.0.10.in-addr.arpa. (40)
22:40:09.596825 IP 10.0.2.3.domain > 10.0.2.15.44823: 35293* 1/0/0 PTR 10.0.2.15. (63)
22:40:09.597720 IP 10.0.2.15.ssh > 10.0.2.2.52196: Flags [P.], seq 196:448, ack 1, win 61407, length 252
22:40:09.598139 IP 10.0.2.2.52196 > 10.0.2.15.ssh: Flags [.], ack 448, win 65535, length 0
22:40:09.689505 IP 10.0.2.15.51240 > 10.0.2.3.domain: 44470+ PTR? 3.2.0.10.in-addr.arpa. (39)
22:40:09.692722 IP 10.0.2.3.domain > 10.0.2.15.51240: 44470* 1/0/0 PTR 10.0.2.3. (61)
22:40:09.694947 IP 10.0.2.15.ssh > 10.0.2.2.52196: Flags [P.], seq 448:580, ack 1, win 61407, length 132
22:40:09.695032 IP 10.0.2.15.ssh > 10.0.2.2.52196: Flags [P.], seq 580:1088, ack 1, win 61407, length 508
22:40:09.695390 IP 10.0.2.2.52196 > 10.0.2.15.ssh: Flags [.], ack 580, win 65535, length 0
22:40:09.695390 IP 10.0.2.2.52196 > 10.0.2.15.ssh: Flags [.], ack 1088, win 65535, length 0
22:40:09.790356 IP 10.0.2.15.ssh > 10.0.2.2.52196: Flags [P.], seq 1088:1708, ack 1, win 61407, length 620
22:40:09.791035 IP 10.0.2.2.52196 > 10.0.2.15.ssh: Flags [.], ack 1708, win 65535, length 0
22:40:09.895545 IP 10.0.2.15.ssh > 10.0.2.2.52196: Flags [P.], seq 1708:1944, ack 1, win 61407, length 236
22:40:09.896093 IP 10.0.2.2.52196 > 10.0.2.15.ssh: Flags [.], ack 1944, win 65535, length 0
22:40:10.003289 IP 10.0.2.15.ssh > 10.0.2.2.52196: Flags [P.], seq 1944:2180, ack 1, win 61407, length 236
22:40:10.003900 IP 10.0.2.2.52196 > 10.0.2.15.ssh: Flags [.], ack 2180, win 65535, length 0
22:40:10.111157 IP 10.0.2.15.ssh > 10.0.2.2.52196: Flags [P.], seq 2180:2416, ack 1, win 61407, length 236
22:40:10.111797 IP 10.0.2.2.52196 > 10.0.2.15.ssh: Flags [.], ack 2416, win 65535, length 0
22:40:10.214846 IP 10.0.2.15.ssh > 10.0.2.2.52196: Flags [P.], seq 2416:2652, ack 1, win 61407, length 236
22:40:10.215432 IP 10.0.2.2.52196 > 10.0.2.15.ssh: Flags [.], ack 2652, win 65535, length 0
22:40:10.320845 IP 10.0.2.15.ssh > 10.0.2.2.52196: Flags [P.], seq 2652:2888, ack 1, win 61407, length 236
22:40:10.321485 IP 10.0.2.2.52196 > 10.0.2.15.ssh: Flags [.], ack 2888, win 65535, length 0
22:40:10.422857 IP 10.0.2.15.ssh > 10.0.2.2.52196: Flags [P.], seq 2888:3124, ack 1, win 61407, length 236
22:40:10.423495 IP 10.0.2.2.52196 > 10.0.2.15.ssh: Flags [.], ack 3124, win 65535, length 0
22:40:10.531551 IP 10.0.2.15.ssh > 10.0.2.2.52196: Flags [P.], seq 3124:3360, ack 1, win 61407, length 236
22:40:10.532203 IP 10.0.2.2.52196 > 10.0.2.15.ssh: Flags [.], ack 3360, win 65535, length 0
22:40:10.639009 IP 10.0.2.15.ssh > 10.0.2.2.52196: Flags [P.], seq 3360:3596, ack 1, win 61407, length 236
22:40:10.639641 IP 10.0.2.2.52196 > 10.0.2.15.ssh: Flags [.], ack 3596, win 65535, length 0
22:40:10.742932 IP 10.0.2.15.ssh > 10.0.2.2.52196: Flags [P.], seq 3596:3832, ack 1, win 61407, length 236
22:40:10.743788 IP 10.0.2.2.52196 > 10.0.2.15.ssh: Flags [.], ack 3832, win 65535, length 0
22:40:10.846552 IP 10.0.2.15.ssh > 10.0.2.2.52196: Flags [P.], seq 3832:4068, ack 1, win 61407, length 236
22:40:10.847161 IP 10.0.2.2.52196 > 10.0.2.15.ssh: Flags [.], ack 4068, win 65535, length 0
22:40:10.950694 IP 10.0.2.15.ssh > 10.0.2.2.52196: Flags [P.], seq 4068:4304, ack 1, win 61407, length 236
22:40:10.951130 IP 10.0.2.2.52196 > 10.0.2.15.ssh: Flags [.], ack 4304, win 65535, length 0
22:40:11.096098 IP 10.0.2.15.ssh > 10.0.2.2.52196: Flags [P.], seq 4304:4540, ack 1, win 61407, length 236
22:40:11.096510 IP 10.0.2.2.52196 > 10.0.2.15.ssh: Flags [.], ack 4540, win 65535, length 0